index,comment,additional_cost,functional_complaint,compatibility_issue,crashing,feature_removal,feature_request,network_problem,privacy_and_ethical_issue,resource_heavy,response_time,user_interface,safety,installation_issue,traffic_wasting,content,update_issue,other
2898,越来越差，全是垃圾新闻，全是推送广告，越更新越没得水准，只好卸载了…  滚吧头条,0,0,0,0,1,0,0,0,0,0,0,0,0,0,1,1,0
2899,没法更新了，视频也是没法播放。,0,1,0,0,0,0,0,0,0,0,0,0,0,0,0,0,0
2900,更新后无法使用,0,0,0,1,0,0,0,0,0,0,0,0,0,0,0,1,0
2901,更新停止好吗！,0,0,0,0,0,0,0,0,0,0,0,0,0,0,0,1,0
2902,很没用，比腾讯网易差多了,0,0,0,0,0,0,0,0,0,0,0,0,0,0,0,0,1
2903,这个头条出了问题我反馈他们也不理。感觉这个头条也是太太差了，,0,0,0,0,0,0,0,0,0,0,0,0,0,0,0,0,1
2904,真心不舍啊，真的很喜欢头条，可没办法，总是无缘无故删我的贴，这很没意思的。,0,0,0,0,0,0,0,0,0,0,0,0,0,0,0,0,1
2905,流氓软件,0,0,0,0,0,0,0,0,0,0,0,0,0,0,0,0,1
2906,垃圾  总是自动删除我的评论  ，不让评论 还玩个什么劲,0,0,0,0,0,0,0,0,0,0,0,0,0,0,0,0,1
2907,QQ登录时会弹出,0,1,0,0,0,0,0,0,0,0,0,0,0,0,0,0,0
2908,差。,0,0,0,0,0,0,0,0,0,0,0,0,0,0,0,0,1
2909,头疼,0,0,0,0,0,0,0,0,0,0,0,0,0,0,0,0,1
2910,什么鬼东西。加载不了,0,1,0,0,0,0,0,0,0,0,0,0,0,0,0,0,0
2911,还挺吧,0,0,0,0,0,0,0,0,0,0,0,0,0,0,0,0,1
2912,以前还蛮好用的，一直在用。后来不知道怎么了就一直看不到！我都卸载在下载了好几次都没用！说什么网络超时！！！不开心,0,0,0,0,0,0,1,0,0,0,0,0,0,0,0,0,0
2913,有时候老是无法评论,0,1,0,0,0,0,0,0,0,0,0,0,0,0,0,0,0
2914,一般,0,0,0,0,0,0,0,0,0,0,0,0,0,0,0,0,1
2915,界面越来越不人性化了,0,0,0,0,0,0,0,0,0,0,1,0,0,0,0,0,0
2916,天天更新   烦不烦   又没见什么新玩意,0,0,0,0,0,0,0,0,0,0,0,0,0,0,0,1,0
2917,总是多打开几分钟就卡死直接关闭了,0,0,0,1,0,0,0,0,0,0,0,0,0,0,0,0,0
2918,光自动停止运行,0,0,0,1,0,0,0,0,0,0,0,0,0,0,0,0,0
2919,感觉头条越来越差劲了！越来越不如一点资讯了,0,0,0,0,0,0,0,0,0,0,0,0,0,0,0,0,1
2920,更新了经常卡顿说无响应～然后退出。,0,0,0,1,0,0,0,0,0,0,0,0,0,0,0,0,0
2921,插件加载失败！！自从更新以后总是出现这个问题，每天盯着圆圈圈转呀转的！真无语了！直接打开客户端能看，就是麻烦！！,0,1,0,0,0,0,0,0,0,0,0,0,0,0,0,1,0
2922,建议可以用设置把新闻底部得评论栏关闭隐藏，大屏手机划屏经常误触。我就是不喜欢评论得那一类！,0,0,0,0,0,1,0,0,0,0,0,0,0,0,0,0,0
2923,内容质量不高，我要卸载了。尤其内容的真实性有待使用者辨别。,0,0,0,0,0,0,0,0,0,0,0,0,0,0,1,0,0
2924,感觉越来越不好用了。新闻越来越少,0,0,0,0,0,0,0,0,0,0,0,0,0,0,1,0,0
2925,为什么没法登录，不能看视频，只有我么,0,1,0,0,0,0,0,0,0,0,0,0,0,0,0,0,0
2926,下载了好几次，也卸载了好几次，总是期望他会好，到最后换来的都是失望，今日头条简直了，太垃圾了，网特别好的时候连视频都打不开，太让我失望了，差评差评，，，，，，果断卸载，再也不用了,0,1,0,0,0,0,0,0,0,0,0,0,0,0,0,0,0
2927,看头条主要看评论，现在评论每次都不出来，垃圾！,0,1,0,0,0,0,0,0,0,0,0,0,0,0,0,0,0
2928,视频老是放不出，咋回事。并且卸不掉该软件(36O下载),0,1,0,0,0,0,0,0,0,0,0,0,0,0,0,0,0
2929,今天不知什么原因总是闪退,0,0,0,1,0,0,0,0,0,0,0,0,0,0,0,0,0
2930,为什么看不了评论,0,1,0,0,0,0,0,0,0,0,0,0,0,0,0,0,0
2931,为什么好多新闻都是已删除。,0,1,0,0,0,0,0,0,0,0,0,0,0,0,0,0,0
2932,该内容已被删除？。。这是什么鬼,0,1,0,0,0,0,0,0,0,0,0,0,0,0,0,0,0
2933,我呵呵，一更新，点什么新闻都是内容已删除。真是醉了。,0,1,0,0,0,0,0,0,0,0,0,0,0,0,0,0,0
2934,手上也有一款类似的软件，仙人掌股票，得好好比较下,0,0,0,0,0,0,0,0,0,0,0,0,0,0,0,0,1
2935,wifi下网铬错误，怎么回事，几天了。,0,0,0,0,0,0,1,0,0,0,0,0,0,0,0,0,0
2936,怎么今天刷新失败,0,0,0,0,0,0,1,0,0,0,0,0,0,0,0,0,0
2937,没法用了，wifi下总是网络错误无法刷新,0,0,0,0,0,0,1,0,0,0,0,0,0,0,0,0,0
2938,里面脑残太多，喷子太多。实在是恶心，卸载了,0,0,0,0,0,0,0,0,0,0,0,0,0,0,1,0,0
2939,还经常炒作，文玩，石头，崖柏，皮草，都特么广告炒作,0,0,0,0,0,0,0,0,0,0,0,0,0,0,1,0,0
2940,"我给第一个差评前，差评总数511，连续给了几个差评，总数还是511,你还信头条吗，征集被头条信息所骗的人一起维权，替诈骗团伙发布诈骗信息，头条也有责任",0,0,0,0,0,0,0,0,0,0,0,0,0,0,0,0,1
2941,不知道给好评的人是怎么给的，整个一诈骗团伙帮凶，替诈骗团伙发一布诈骗信息的工具,0,0,0,0,0,0,0,0,0,0,0,0,0,0,0,0,1
2942,诈骗信息太多，让人防不胜防，一不小心就被骗，属于骗子同伙，,0,0,0,0,0,0,0,0,0,0,0,0,0,0,0,0,1
2943,差劲，再不要下了。,0,0,0,0,0,0,0,0,0,0,0,0,0,0,0,0,1
2944,你大爷 有广告,0,0,0,0,1,0,0,0,0,0,0,0,0,0,0,0,0
2945,wifi下刷新不出来，流量下能行,0,0,0,0,0,0,1,0,0,0,0,0,0,0,0,0,0
2946,看不了视频了,0,1,0,0,0,0,0,0,0,0,0,0,0,0,0,0,0
2947,就是里面的虚假广告，骗子广告太多，说是免费办信用卡，最后交费成了无底洞,0,0,0,0,1,0,0,0,0,0,0,0,0,0,0,0,0
2948,近一段时间，今日头条不好用了，刷新很慢，油卡顿的现象。,0,0,0,0,0,0,1,0,0,1,0,0,0,0,0,0,0
2949,怎么刷新这么费劲？,0,0,0,0,0,0,1,0,0,0,0,0,0,0,0,0,0
2950,请问离线下载的新闻中的图片怎么一个都打不开？,0,1,0,0,0,0,0,0,0,0,0,0,0,0,0,0,0
2951,这个软件可以用“低俗”“恶俗”两个词来形容，内容完全失去了新闻的价值和新闻从业者的道德底线，尤其上边一些关于“政治”，“历史”的评论文章，水平有限，观点更是语不惊人死不休！只能是附和那些智商低下，心智不健全的喷子和智障人士的兴趣！我有的时候也会阅读一些新闻，但是只是当成每日来让我噗嗤一笑！实在不能忍，我会向相关部门去举报！当今社会风气本来急转直下，再让这样无底线的媒体存在，实在让人不能忍,0,0,0,0,0,0,0,0,0,0,0,0,0,0,1,0,0
2952,网络错误,0,0,0,0,0,0,1,0,0,0,0,0,0,0,0,0,0
2953,一个充满五毛俄杂，各种淫秽下三滥段子的媒体，评论全是一边倒，和网易一样为了流量不择手段，两个极端网站，两个没有底线的垃圾媒体。,0,0,0,0,0,0,0,0,0,0,0,0,0,0,1,0,0
2954,以前很好用，但是现在评论老是被删！！！建议别用,0,0,0,0,0,0,0,0,0,0,0,0,0,0,0,0,1
2955,差，真心不好,0,0,0,0,0,0,0,0,0,0,0,0,0,0,0,0,1
2956,头条自己看看大家的评论，更新以后无法在wlan下使用了，只能用流量看，扯蛋的更新。,0,0,0,0,0,0,1,0,0,0,0,0,0,0,0,1,0
2957,千万不要买今日头条发布的广告产品，货到付款买了行车记录仪，货到时根本无法测试，结果除了外观，其他与广告功能完全不同。经查询完全是三无产品，向工商税务警察等五个部门报案后，回复除了推委就是查无此公司。只好自认倒霉。今日头条就是帮凶。里面的股票信息更是杀人利器。奉劝各位不要再下这个软件。,0,0,0,0,0,0,0,0,0,0,0,0,0,0,0,0,1
2958,没有视频了，加上以后也出不来,0,1,0,0,0,0,0,0,0,0,0,0,0,0,0,0,0
2959,更新后只能使用流量阅渎了,0,0,0,0,0,0,0,0,0,0,0,0,0,0,0,1,0
2960,尼玛的隔三差五就更新，真是没吊事瞎浪费大家的流量！,0,0,0,0,0,0,0,0,0,0,0,0,0,0,0,1,0
2961,底部提示栏没有了不方便。,0,0,0,0,0,1,0,0,0,0,1,0,0,0,0,0,0
2962,更新过后，新聞根本没法刷新，越來越垃圾了,0,0,0,0,0,0,1,0,0,0,0,0,0,0,0,1,0
2963,更新过后怎么看不到新闻了，老是说刷新超时。,0,0,0,0,0,0,1,0,0,0,0,0,0,0,0,1,0
2964,里面一些评论的人的素质也真是够了，地域歧视很严重，有时候出一件小事，都能把那个地方的人一概而论地骂，问候人家祖宗十八代，外国的什么新闻出来，都能扯上，在外国怎样怎样，在中国怎样怎样，在他们的眼里，外国的月亮就是圆，里面人的综合素质，网络修养普遍没有微博的高,0,0,0,0,0,0,0,0,0,0,0,0,0,0,1,0,0
2965,差评,0,0,0,0,0,0,0,0,0,0,0,0,0,0,0,0,1
2966,本来刚卸载了，但是想到要回来评论，还是先下回来，评论完再卸载。已经用了几年了，但是做的实在让我们寒心。说个表面的，广告多了，以前软件开启是根本没有广告的，而且内置广告也多了，每篇文章下面都是广告，还是那种很露骨的，让我们很反感。再说个内幕，头条的账号，就是发文章的那些，普通用户申请，随便找个理由拒绝你，极易不通过，然后暗地卖账号，因为账号写文章是有广告分成的，软件做大了就目中无人，小人嘴脸。,0,0,0,0,1,0,0,0,0,0,0,0,0,0,0,0,0
2967,呵呵呵这玩意以前下过没意思就卸载了现在倒好没动它然后开始手机预装了是吧？莫名其妙就下下来了还没啥好用的还不能卸载真恶心了,0,0,0,0,0,0,0,0,0,0,0,0,0,0,0,0,1
2968,程序员吃s的吗？？？越来越卡！！！,0,0,0,0,0,0,0,0,0,1,0,0,0,0,0,0,0
2969,我的评论有一些都不显示出来的,0,1,0,0,0,0,0,0,0,0,0,0,0,0,0,0,0
2970,大家不要下载，这个就是一个垃圾软件，乱删评论,0,0,0,0,0,0,0,0,0,0,0,0,0,0,0,0,1
2971,一颗星都不想给，垃圾软件，总是乱删评论,0,0,0,0,0,0,0,0,0,0,0,0,0,0,0,0,1
2972,很多新闻都打不开，不仅仅是手机和网速的问题吧,0,1,0,0,0,0,1,0,0,0,0,0,0,0,0,0,0
2973,今天都打不开了,0,1,0,0,0,0,0,0,0,0,0,0,0,0,0,0,0
2974,昨晚到现在打不开了，烂死了,0,1,0,0,0,0,0,0,0,0,0,0,0,0,0,0,0
2975,艹特么的手贱升了级 不说了现在正在网上搜旧版本喵的关键还不记得以前是什么版本,0,0,0,0,0,0,0,0,0,0,0,0,0,0,0,1,0
2976,打不开,0,1,0,0,0,0,0,0,0,0,0,0,0,0,0,0,0
2977,越来越垃圾，越来越卡，现在显示内容好慢,0,0,0,0,0,0,1,0,0,1,0,0,0,0,0,0,0
2978,给它一星的评价真的是没办法了。我现在都觉得给它一星的评价都是在抬举它。如果星星可以有负的评价的话，那我真想给它个负的满分,0,0,0,0,0,0,0,0,0,0,0,0,0,0,0,0,1
2979,更新后下面的好多按键没了真不方便,0,0,0,0,0,0,0,0,0,0,1,0,0,0,0,1,0
2980,一直闪退，不好用,0,0,0,1,0,0,0,0,0,0,0,0,0,0,0,0,0
2981,更新后，老是闪退，神马情况这是…………,0,0,0,1,0,0,0,0,0,0,0,0,0,0,0,1,0
2982,天天都更新，能不能弄个稳定点的再发布啊！,0,0,0,0,0,0,0,0,0,0,0,0,0,0,0,1,0
2983,点范冰冰的新闻不能点赞，骂张馨予的话发不出去，真怀疑头条是张馨予请来专门黑范冰冰的，你们头条工作人员再作假给张馨予当孙子死全家,0,0,0,0,0,0,0,0,0,0,0,0,0,0,0,0,1
2984,垃圾越更新越垃圾，现在经常程序崩溃，闪退，刷新没反应。而且刷新越来越慢，垃圾和你说拜拜了。,0,0,0,1,0,0,1,0,0,0,0,0,0,0,0,1,0
2985,无法搜索想要或看过的文章。添加这个功能啊，很有用处！！！！新版不如旧版画面感好。,0,0,0,0,0,1,0,0,0,0,1,0,0,0,0,1,0
2986,版本信息那里有旧版的……,0,0,0,0,0,0,0,0,0,0,0,0,0,0,0,0,1
2987,刚更新完，我的消息和个人主页都加载不出来！！！！！！,0,1,0,0,0,0,0,0,0,0,0,0,0,0,0,1,0
2988,最近老是刷新不出，以为自己被举报了呢,0,1,0,0,0,0,0,0,0,0,0,0,0,0,0,0,0
2989,越改越烂,0,0,0,0,0,0,0,0,0,0,0,0,0,0,0,0,1
2990,是要倒闭了吗？新闻都刷不出来,0,1,0,0,0,0,0,0,0,0,0,0,0,0,0,0,0
2991,什么鬼，刷新不到新闻。,0,1,0,0,0,0,0,0,0,0,0,0,0,0,0,0,0
2992,今日广告！,0,0,0,0,1,0,0,0,0,0,0,0,0,0,0,0,0
2993,现在越来越垃圾了，质量低下，广告倒是增加不是,0,0,0,0,1,0,0,0,0,0,0,0,0,0,0,0,0
2994,一分钟跑50兆怕不怕……还能不能愉快玩耍,0,0,0,0,0,0,1,0,0,0,0,0,0,0,0,0,0
2995,更新之后闪退  以前没事的，手机型号galaxy J,0,0,0,1,0,0,0,0,0,0,0,0,0,0,0,1,0
2996,里面评论的负能量太多,0,0,0,0,0,0,0,0,0,0,0,0,0,0,1,0,0
2997,自从更新了，就什么都刷新不出来了,0,0,0,0,0,0,1,0,0,0,0,0,0,0,0,1,0
2998,我想问下，如果装回原来的版本？,0,0,0,0,0,0,0,0,0,0,0,0,0,0,0,1,0
2999,打不开，太差,0,0,0,1,0,0,0,0,0,0,0,0,0,0,0,0,0
3000,居然吧点赞功能取消了，特地过来评价的，马上卸载，，，，，,0,0,0,0,0,1,0,0,0,0,0,0,0,0,0,0,0
3001,把顶 踩还来,0,0,0,0,0,1,0,0,0,0,0,0,0,0,0,0,0
3002,闪退一年了，都修不好，垃圾,0,0,0,1,0,0,0,0,0,0,0,0,0,0,0,0,0
3003,老闪退，刚读到半截就闪退了，烦死了,0,0,0,1,0,0,0,0,0,0,0,0,0,0,0,0,0
3004,一星都不想给，没顶踩就是个垃圾，卸载,0,0,0,0,0,1,0,0,0,0,0,0,0,0,0,0,0
3005,不要更新，否则你会后悔的！,0,0,0,0,0,0,0,0,0,0,0,0,0,0,0,1,0
3006,顶踩功能怎么没有了？,0,0,0,0,0,1,0,0,0,0,0,0,0,0,0,0,0
3007,不好用,0,0,0,0,0,0,0,0,0,0,0,0,0,0,0,0,1
3008,总闪退，什么情况？,0,0,0,1,0,0,0,0,0,0,0,0,0,0,0,0,0
3009,用电大户，不敢恭维，能否改善一下！！,0,0,0,0,0,0,0,0,1,0,0,0,0,0,0,0,0
3010,貌似手机看新闻一个不去一个爽，没有什么实质性东西。,0,0,0,0,0,0,0,0,0,0,0,0,0,0,1,0,0
3011,说实话这个软件挺可怕的，我淘宝逛什么百度搜什么，他里面的推广就给我推广什么，用户早已没有隐私。,0,0,0,0,0,0,0,1,0,0,0,0,0,0,0,0,0
3012,我看了几天这个软件的新闻，部分文章针对性主观性太强，一点都不客观，还有些文章明显是黑别人的，失去了一个媒体还有的客观真实性，我也不敢断言说他们收了多少钱，至少我觉得这不是一个好的新闻软件，再看下去完全要被误导。,0,0,0,0,0,0,0,0,0,0,0,0,0,0,1,0,0
3013,更新后各种BUG，各种闪退，坑爹玩意。大家别下了,0,0,0,1,0,0,0,0,0,0,0,0,0,0,0,1,0
3014,服务器错误，根本看不了，什么呀！,0,0,0,0,0,0,1,0,0,0,0,0,0,0,0,0,0
3015,服务器异常，不能看,0,0,0,0,0,0,1,0,0,0,0,0,0,0,0,0,0
3016,自从点了更新的我眼泪掉下来,0,0,0,0,0,0,0,0,0,0,0,0,0,0,0,1,0
3017,比较习惯头条的页面……但是为么能看电视的网却刷新不了头条？老是连接超时！！好无奈阿……真想卸载掉……能处理下这种情况吗？头条之前都是好评，现在更新了，都是差评！！！,0,0,0,0,0,0,1,0,0,0,0,0,0,0,0,1,0
3018,为什么最近用不了？刷新时总是提示服务繁忙。,0,0,0,0,0,0,1,0,0,0,0,0,0,0,0,0,0
3019,那都好，就是广告太多。,0,0,0,0,1,0,0,0,0,0,0,0,0,0,0,0,0
3020,还不错,0,0,0,0,0,0,0,0,0,0,0,0,0,0,0,0,1
3021,越更新越垃圾了,0,0,0,0,0,0,0,0,0,0,0,0,0,0,0,1,0
3022,更新后连wifi根本都用不了了。这么烂。果断卸载,0,1,0,0,0,0,0,0,0,0,0,0,0,0,0,1,0
3023,更新后怎么没法儿安装啊？？！！,0,1,0,0,0,0,0,0,0,0,0,0,0,0,0,0,0
3024,什么呀升级了、打不开？,0,0,0,1,0,0,0,0,0,0,0,0,0,0,0,0,0
3025,根本用不了,0,1,0,0,0,0,0,0,0,0,0,0,0,0,0,0,0
3026,越来越垃圾，新闻更新太慢，失去新闻的时效性，广告太多。,0,0,0,0,1,0,0,0,0,0,0,0,0,0,1,0,0
3027,网络错误，打不开了,0,0,0,0,0,0,1,0,0,0,0,0,0,0,0,0,0
3028,好不解决问题？,0,0,0,0,0,0,0,0,0,0,0,0,0,0,0,0,1
3029,广告，八卦太多有价值的新闻越来越少。,0,0,0,0,1,0,0,0,0,0,0,0,0,0,1,0,0
3030,更新后闪退，图片海出不来，哈不如不更新,0,1,0,1,0,0,0,0,0,0,0,0,0,0,0,1,0
3031,更新后都是加载超时,0,0,0,0,0,0,1,0,0,0,0,0,0,0,0,1,0
3032,为什么我安装老提示内存不足？可是还余200多M，而且别的软件可以装的。,0,0,0,0,0,0,0,0,0,0,0,0,1,0,0,0,0
3033,又一个广告，五毛的刷屏阵地，为了赚钱掩耳盗铃，何必呢，直接取消评论多清净。,0,0,0,0,1,0,0,0,0,0,0,0,0,0,1,0,0
3034,更新不出来文章。,0,0,0,0,0,0,0,0,0,0,0,0,0,0,0,0,1
3035,打开这个有的软件就偷偷启动什么原因,0,0,0,0,1,0,0,0,0,0,0,0,0,0,0,0,0
3036,垃圾，总是大姨妈，经常断网，连接不上服务器，重下也不好使，真他么傻逼，一直没解决这一bug！,0,0,0,0,0,0,1,0,0,0,0,0,0,0,0,0,0
3037,今日头条最近老是大姨妈，动不动就连不上服务器，刷新不好使，重下也不好使，网络一点问题没有，各种权限都给了，真是醉了！,0,0,0,0,0,0,1,0,0,0,0,0,0,0,0,0,0
3038,老是没连接，这是第二次了，越做越差,0,0,0,0,0,0,1,0,0,0,0,0,0,0,0,0,0
3039,不咋好,0,0,0,0,0,0,0,0,0,0,0,0,0,0,0,0,1
3040,还好,0,0,0,0,0,0,0,0,0,0,0,0,0,0,0,0,1
3041,推送太多！启动有广告！！！！,0,0,0,0,1,0,0,0,0,0,0,0,0,0,0,0,0
3042,fuck,0,0,0,0,0,0,0,0,0,0,0,0,0,0,0,0,1
3043,头条新闻不能修改错误评论，也不能删除，达不到有错即改的要求，悲催！,0,0,0,0,0,1,0,0,0,0,0,0,0,0,0,0,0
3044,每次还没打开就是广告，真不知道这公司会不会经营，懂不懂用户的感受啊，太烦了，果断卸载,0,0,0,0,1,0,0,0,0,0,0,0,0,0,0,0,0
3045,超级喜欢！！！！！！,0,0,0,0,0,0,0,0,0,0,0,0,0,0,0,0,1
3046,怎么删除自己发表的评论？,0,0,0,0,0,1,0,0,0,0,0,0,0,0,0,0,0
3047,好垃圾夜间模式经常白屏好闪眼睛,0,1,0,0,0,0,0,0,0,0,0,0,0,0,0,0,0
3048,更新后看不见别人的评论的，哎删除,0,0,0,0,0,1,0,0,0,0,0,0,0,0,0,1,0
3049,不行了    新版不如老版本     字非常小    毛病多！,0,0,0,0,0,0,0,0,0,0,1,0,0,0,0,1,0
3050,很不友好的软件，恶意删除评论，不推荐使用,0,0,0,0,1,0,0,0,0,0,0,0,0,0,0,0,0
3051,垃圾，越更新，广告越多，还是老版本好用，没广告,0,0,0,0,1,0,0,0,0,0,0,0,0,0,0,1,0
3052,语音读文章为什么没有了,0,0,0,0,0,1,0,0,0,0,0,0,0,0,0,0,0
3053,凑合,0,0,0,0,0,0,0,0,0,0,0,0,0,0,0,0,1
3054,更新之后首页不能缓存，没网的时候不能用！没以前的好用……,0,0,0,0,0,1,0,0,0,0,0,0,0,0,0,1,0
3055,广告太多了,0,0,0,0,1,0,0,0,0,0,0,0,0,0,0,0,0
3056,有时图片看不了,0,1,0,0,0,0,0,0,0,0,0,0,0,0,0,0,0
3057,忍无可忍删了，头条的小编标题党太多！！！手机、汽车都明显收魅族、哈弗的钱，当读者傻的？？？,0,0,0,0,0,0,0,0,0,0,0,0,0,0,1,0,0
3058,怎么回事，闪退！搞什么！,0,0,0,1,0,0,0,0,0,0,0,0,0,0,0,0,0
3059,返回时出现bug，而且植入广告太烦人,0,1,0,0,1,0,0,0,0,0,0,0,0,0,0,0,0
3060,(≧▽≦),0,0,0,0,0,0,0,0,0,0,0,0,0,0,0,0,1
3061,郑智产物下的垃圾软件 没有闽泉的郭嘉,0,0,0,0,0,0,0,0,0,0,0,0,0,0,0,0,1
3062,还不错,0,0,0,0,0,0,0,0,0,0,0,0,0,0,0,0,1
3063,好,0,0,0,0,0,0,0,0,0,0,0,0,0,0,0,0,1
3064,垃圾,0,0,0,0,0,0,0,0,0,0,0,0,0,0,0,0,1
3065,广告多，新版不如老版本,0,0,0,0,1,0,0,0,0,0,0,0,0,0,0,1,0
3066,无广告你它妈的头，360你眼瞎是不是？植入的广告真尼玛多！,0,0,0,0,1,0,0,0,0,0,0,0,0,0,0,0,0
3067,新闻质量越来越差，小便天天发一些无聊的新闻,0,0,0,0,0,0,0,0,0,0,0,0,0,0,1,0,0
3068,可以离线阅读吗？,0,0,0,0,0,1,0,0,0,0,0,0,0,0,0,0,0
3069,一大堆傻逼新闻，都是胡说八道，根本不严谨，还很多错别字，垃圾软件。,0,0,0,0,0,0,0,0,0,0,0,0,0,0,1,0,0
3070,植入广告太多,0,0,0,0,1,0,0,0,0,0,0,0,0,0,0,0,0
3071,比网页版更新滞后！,0,0,0,0,0,0,0,0,0,0,0,0,0,0,0,0,1
3072,登录个毛，马上删除，评论还要登录。,0,0,0,0,0,1,0,0,0,0,0,0,0,0,0,0,0
3073,我觉得不行-_-||,0,0,0,0,0,0,0,0,0,0,0,0,0,0,0,0,1
3074,里面的小编很垃圾，乱删帖子，就算你说的不违反规定，只要和其说法不对头就删，里面都是推广信息，而且很多变相宣传广告，慎用！不信自己看看里面推广广告，和推广软件多不多！,0,0,0,0,1,0,0,0,0,0,0,0,0,0,1,0,0
3075,还行吧,0,0,0,0,0,0,0,0,0,0,0,0,0,0,0,0,1
3076,垃圾,0,0,0,0,0,0,0,0,0,0,0,0,0,0,0,0,1
3077,还可以,0,0,0,0,0,0,0,0,0,0,0,0,0,0,0,0,1
3078,更新后没有左右滑动上下条信息，反馈后更新几期后也没有改善。,0,0,0,0,0,1,0,0,0,0,0,0,0,0,0,1,0
3079,在我眼中，以任何方式方法迷惑、诱导用户安装其他软件的，都是垃圾。这个也是。果断让他下岗。,0,0,0,0,1,0,0,0,0,0,0,0,0,0,0,0,0
3080,要多垃圾新闻～无聊新闻～刷屏新闻～,0,0,0,0,0,0,0,0,0,0,0,0,0,0,1,0,0
3081,垃圾，里面的新闻很假,0,0,0,0,0,0,0,0,0,0,0,0,0,0,1,0,0
3082,垃圾，那么多广告，都忘了什么才是“头条”，你忘本了,0,0,0,0,1,0,0,0,0,0,0,0,0,0,0,0,0
3083,半好半坏。有时候推荐的挺垃圾的。,0,0,0,0,0,0,0,0,0,0,0,0,0,0,1,0,0
3084,用两天你就会发现……很多广告！,0,0,0,0,1,0,0,0,0,0,0,0,0,0,0,0,0
3085,还好,0,0,0,0,0,0,0,0,0,0,0,0,0,0,0,0,1
3086,还行，挺好的,0,0,0,0,0,0,0,0,0,0,0,0,0,0,0,0,1
3087,老子用这个看新闻半年了，之前的版本都没事，就昨更新一个，一晚上睡觉的时候全部后台加载，有bug麻烦改咯，我也是程序员，像你们这么烂的软件测试过了没？赶紧让测试加紧测试吧，坑爹，其他人下载自己看着办吧，反正我的经历就在这摆着，这个版本我果断卸了，我不是故意捣乱，有图有真相,0,0,0,0,0,0,0,0,0,0,0,0,0,1,0,1,0
3088,tmd，一晚上下载2G流量200M，全部是后台下载，狗P坑爹,0,0,0,0,0,0,0,0,0,0,0,0,0,1,0,0,0
3089,^~^,0,0,0,0,0,0,0,0,0,0,0,0,0,0,0,0,1
3090,你妹啊，怎么没房产频道,0,0,0,0,0,0,0,0,0,0,0,0,0,0,1,0,0
3091,有广告，360肯定收钱了，,0,0,0,0,1,0,0,0,0,0,0,0,0,0,0,0,0
3092,相比其它软件费流量,0,0,0,0,0,0,0,0,0,0,0,0,0,1,0,0,0
3093,还好,0,0,0,0,0,0,0,0,0,0,0,0,0,0,0,0,1
3094,大家有木有觉得头条编辑推荐的新闻价值在下降，现在更多的是广告和娱乐,0,0,0,0,0,0,0,0,0,0,0,0,0,0,1,0,0
3095,一般的垃圾,0,0,0,0,0,0,0,0,0,0,0,0,0,0,0,0,1
3096,什么破软件 还带病毒，卸载以后它又自己安装上....,0,0,0,0,0,0,0,0,0,0,0,0,0,0,0,0,1
3097,凑合着用吧,0,0,0,0,0,0,0,0,0,0,0,0,0,0,0,0,1
3098,好卡呀。,0,0,0,0,0,0,0,0,0,1,0,0,0,0,0,0,0
3099,垃圾新闻，尽是一些黑人的新闻,0,0,0,0,0,0,0,0,0,0,0,0,0,0,1,0,0
3100,老是自动安装 装了还重启 垃级一个,0,0,0,0,0,0,0,0,0,0,0,0,0,0,0,0,1
3101,这软件会获取用户隐私， 针对你经常关注的新闻，会有广告邮件发到你qq邮箱,0,0,0,0,0,0,0,1,0,0,0,0,0,0,0,0,0
3102,不怎么样！失望。,0,0,0,0,0,0,0,0,0,0,0,0,0,0,0,0,1
3103,今日头条快成养生头条了…,0,0,0,0,0,0,0,0,0,0,0,0,0,0,1,0,0
3104,不错,0,0,0,0,0,0,0,0,0,0,0,0,0,0,0,0,1
3105,恶意扣费垃圾广告隐私盗取！,0,0,0,0,1,0,0,1,0,0,0,1,0,0,0,0,0
3106,插件不好用,0,1,0,0,0,0,0,0,0,0,0,0,0,0,0,0,0
3107,很好，新闻很及时，还有评论栏我很喜欢看。,0,0,0,0,0,0,0,0,0,0,0,0,0,0,0,0,1
3108,垃圾 自己的新闻评论根本不显示！,0,1,0,0,0,0,0,0,0,0,0,0,0,0,0,0,0
3109,娱乐新闻太多，我天天去了解这些八卦干嘛。,0,0,0,0,0,0,0,0,0,0,0,0,0,0,1,0,0
3110,bingdu,0,0,0,0,0,0,0,0,0,0,0,0,0,0,0,0,1
3111,非常差，别用,0,0,0,0,0,0,0,0,0,0,0,0,0,0,0,0,1
3112,更新的是个几把！！！新界面真他嘛难看！更他嘛难用！！！,0,0,0,0,0,0,0,0,0,0,1,0,0,0,0,1,0
3113,难道没有人发现会有广告弹窗么？居然自动开始下载，还是什么美女视频之类的，关都关不掉，果断卸载之。。。,0,0,0,0,1,0,0,0,0,0,0,0,0,0,0,0,0
3114,总是卡，好烦,0,0,0,0,0,0,0,0,0,1,0,0,0,0,0,0,0
3115,垃圾软件，净说些屌丝小事。没有国际时政要闻。果断卸载,0,0,0,0,0,0,0,0,0,0,0,0,0,0,1,0,0
3116,为什么今日头条的桌面小工具一旦上下拖动就卡死了，而且必须重启手机才能恢复？希望刚快改善！我的手机是华为c8812e,0,1,1,1,0,0,0,0,0,0,0,0,0,0,0,0,0
3117,感觉不错,0,0,0,0,0,0,0,0,0,0,0,0,0,0,0,0,1
3118,太耗流量了！,0,0,0,0,0,0,0,0,0,0,0,0,0,1,0,0,0
3119,用QQ登陆不了，那就算了，在分类随便点个等半天给你显示网络错误，我确定网络没问题的。这样也就算了，我给你们意见反馈总行吧！写好点发送，显示的不是成功而是网络错误。我郁闷，我就去打开百度新闻试试网络。可以啊！可见是软件垃圾。果断卸载！,0,1,0,0,0,0,1,0,0,0,0,0,0,0,0,0,0
3120,"\卜呀:+:,505541-++-,3141-@+@1144",0,0,0,0,0,0,0,0,0,0,0,0,0,0,0,0,1
3121,请多报道其他的新闻，不要老是报苹果的新闻，OK？,0,0,0,0,0,0,0,0,0,0,0,0,0,0,1,0,0
3122,软件其实还不错，但是里面的内容很多时候有些滥竽充数的感觉,0,0,0,0,0,0,0,0,0,0,0,0,0,0,1,0,0
3123,尼玛 其实一直很喜欢的  但越更新越垃圾！刷新竟然总是提示：网络错误，请重试！ 重试N次还是这样？我去年买了个表！！！,0,0,0,0,0,0,1,0,0,0,0,0,0,0,0,0,0
3124,居然有广告，，，，垃圾,0,0,0,0,1,0,0,0,0,0,0,0,0,0,0,0,0
3125,你们没有发现，你们分享的新闻在电脑上打不开吗？希望官网可以解决这个问题。,0,1,0,0,0,0,0,0,0,0,0,0,0,0,0,0,0
3126,还行吧，,0,0,0,0,0,0,0,0,0,0,0,0,0,0,0,0,1
3127,还可以吧,0,0,0,0,0,0,0,0,0,0,0,0,0,0,0,0,1
3128,都给过好评，一直索要好评！很烦,0,0,0,0,1,0,0,0,0,0,0,0,0,0,0,0,0
3129,怎么回事。现在使用老是自动退出！根本用不了！！！难道与其它软件有冲突吗？,0,0,0,1,0,0,0,0,0,0,0,0,0,0,0,0,0
3130,愁，手机用着个看新闻死机两次了,0,0,0,1,0,0,0,0,0,0,0,0,0,0,0,0,0
3131,还有段子一项，熟悉的朋友都知道是来自内涵段子的软件，一些词语都不可以使用，说不合法，比如老子用LZ城管用Cg等，为我们阅读带来很多障碍,0,0,0,0,0,0,0,0,0,0,0,0,0,0,0,0,1
3132,挺好,0,0,0,0,0,0,0,0,0,0,0,0,0,0,0,0,1
3133,不错的说,0,0,0,0,0,0,0,0,0,0,0,0,0,0,0,0,1
