index,comment,additional_cost,functional_complaint,compatibility_issue,crashing,feature_removal,feature_request,network_problem,privacy_and_ethical_issue,resource_heavy,response_time,user_interface,safety,installation_issue,traffic_wasting,content,update_issue,other
898,装了之后开始正常，关机后再开机，亮屏后再也不反应了……,0,0,0,1,0,0,0,0,0,0,0,0,0,0,0,0,0
899,为什么更新后图标变的好大、不喜欢这样的、还是喜欢没更新的。真垃圾。,0,0,0,0,0,0,0,0,0,0,1,0,0,0,0,1,0
900,靠，后悔更新了,0,0,0,0,0,0,0,0,0,0,0,0,0,0,0,1,0
901,"华为g610c,老是停止运行，导致死机。",0,0,1,1,0,0,0,0,0,0,0,0,0,0,0,0,0
902,烂，都没有显示天气预报,0,0,0,0,0,1,0,0,0,0,0,0,0,0,0,0,0
903,主题那么丑那么幼稚为什么有那么多人用。。。。,0,0,0,0,0,0,0,0,0,0,0,0,0,0,0,0,1
904,更新以后下载了消息提示器了，为什么未接电话未读短信还是没有数量显示的啊？求解,0,1,0,0,0,0,0,0,0,0,0,0,0,0,0,0,0
905,功能还挺多的，就是下主题的时候会闪退，占的内存也太大了，望改进,0,0,0,1,0,0,0,0,1,0,0,0,0,0,0,0,0
906,主题还要钱,1,0,0,0,0,0,0,0,0,0,0,0,0,0,0,0,0
907,说实在的，没91好,0,0,0,0,0,0,0,0,0,0,0,0,0,0,0,0,1
908,更新后，不管登录微信还是QQ，或者打电话挂断后，都会卡机几秒，然后出现360桌面停止工作!有BUG赶紧修复!,0,0,0,1,0,0,0,0,0,0,0,0,0,0,0,1,0
909,老卡住，无响应，望360改进。,0,0,0,1,0,0,0,0,0,0,0,0,0,0,0,0,0
910,更新之后壁纸被拉长了好难看早知道不更新囖,0,0,0,0,0,0,0,0,0,0,0,0,0,0,0,1,0
911,差的要死，好看一点的还要钱，艹,1,0,0,0,0,0,0,0,0,0,0,0,0,0,0,0,0
912,期待、,0,0,0,0,0,0,0,0,0,0,0,0,0,0,0,0,1
913,还行,0,0,0,0,0,0,0,0,0,0,0,0,0,0,0,0,1
914,我只想说不怎么好，壁纸总喜欢卡屏,0,0,0,0,0,0,0,0,0,1,0,0,0,0,0,0,0
915,无法忍受新的主题。。。花里胡哨。,0,0,0,0,0,0,0,0,0,0,0,0,0,0,0,0,1
916,- -555555555555555555555555555555555555555555555555555555555555555555555555,0,0,0,0,0,0,0,0,0,0,0,0,0,0,0,0,1
917,增添麻烦，不好用,0,0,0,0,0,0,0,0,0,0,0,0,0,0,0,0,1
918,实话越更新越卡，我手机四核 2G内存，回到360桌面都卡得不行甚至死机。已经卸载了弄回手机自带的原版一点不卡,0,0,0,0,0,0,0,0,0,1,0,0,0,0,0,1,0
919,恶心。。。。。。,0,0,0,0,0,0,0,0,0,0,0,0,0,0,0,0,1
920,不好用？来吐吐槽吧~现在的主题不知道是那些鸡粑传的，这么烂,0,0,0,0,0,0,0,0,0,0,0,0,0,0,0,0,1
921,不知道好不好,0,0,0,0,0,0,0,0,0,0,0,0,0,0,0,0,1
922,尼玛，时间又倒流了,0,0,0,0,0,0,0,0,0,0,0,0,0,0,0,0,1
923,去死吧！！！,0,0,0,0,0,0,0,0,0,0,0,0,0,0,0,0,1
924,每次更新后就提示错误，非要重启一次才好,0,0,0,1,0,0,0,0,0,0,0,0,0,0,0,1,0
925,全都要钱，晕！！,1,0,0,0,0,0,0,0,0,0,0,0,0,0,0,0,0
926,抽屉里的图标太小，而且大小还不能调整，果断换回老版本。,0,0,0,0,0,1,0,0,0,0,1,0,0,0,0,1,0
927,你敢说免费 是啊 免费下载 收费使用,1,0,0,0,0,0,0,0,0,0,0,0,0,0,0,0,0
928,为什么刚安装完了，结果桌面主题额背景被无限的放大，以为是手机问题，用别人的下载也是这样，,0,1,0,0,0,0,0,0,0,0,0,0,0,0,0,0,0
929,越来越不好了，再不用心就没人用了,0,0,0,0,0,0,0,0,0,0,0,0,0,0,0,0,1
930,楼下的 下载不好是你手机的问题吧！,0,0,0,0,0,0,0,0,0,0,0,0,0,0,0,0,1
931,其他都挺好，就是能不要这么坑，好看的主题各种要钱。,1,0,0,0,0,0,0,0,0,0,0,0,0,0,0,0,0
932,为什么不支持小工具，一键锁屏啊？？？？why???,0,0,0,0,0,1,0,0,0,0,0,0,0,0,0,0,0
933,垃圾  恶心吧  这桌面卡死了,0,0,0,0,0,0,0,0,0,1,0,0,0,0,0,0,0
934,cao，试用和买来不一样,0,0,0,0,0,0,0,0,0,0,0,0,0,0,0,0,1
935,可惜了一个好桌面，不能到系统里做内置。就得可以钳,0,0,0,0,0,1,0,0,0,0,0,0,0,0,0,0,0
936,更新的真垃圾  单屏壁纸不能用了，很是伤心。。。,0,1,0,0,0,0,0,0,0,0,0,0,0,0,0,1,0
937,用了一年都觉得不错，最后一次更新后滑屏都那么卡顿，要慢慢滑，否则还滑不了，开始还以为是手机的问题，又是清理又是卸载软件的，可还是不行，最后卸载之后才发现原装桌面好用多了。。。,0,0,0,0,0,0,0,0,0,1,0,0,0,0,0,1,0
938,根本不能用购买主题，提交就白屏,0,1,0,1,0,0,0,0,0,0,0,0,0,0,0,0,0
939,超级卡 别用,0,0,0,0,0,0,0,0,0,1,0,0,0,0,0,0,0
940,"妈的
艹蛋......",0,0,0,0,0,0,0,0,0,0,0,0,0,0,0,0,1
941,这个软件下载完了手机游戏就卡了很多,0,0,0,0,0,0,0,0,1,0,0,0,0,0,0,0,0
942,卡死了......,0,0,0,0,0,0,0,0,0,1,0,0,0,0,0,0,0
943,有闪屏的现象,0,1,0,0,0,0,0,0,0,0,0,0,0,0,0,0,0
944,你妹啊、、要钱、、果断卸载！！！！！！！,1,0,0,0,0,0,0,0,0,0,0,0,0,0,0,0,0
945,尼玛，卡的要死，魔秀怎么没有了啊,0,0,0,0,0,0,0,0,0,1,0,0,0,0,0,0,0
946,壁纸的一键搜索在哪里,0,0,0,0,0,0,0,0,0,0,0,0,0,0,0,0,1
947,怎么不能自动整理归类了？下了一大堆图标，看看也不清,0,0,0,0,0,1,0,0,0,0,0,0,0,0,0,0,0
948,好多收费  伤不起,1,0,0,0,0,0,0,0,0,0,0,0,0,0,0,0,0
949,360的东西都很强大，可是收费就不是很喜欢，同学也有用RUI桌面的，看了下，美化效果还不错的！准备下手试试啊！,1,0,0,0,0,0,0,0,0,0,0,0,0,0,0,0,0
950,垃圾，卡死，装上以后开机还定屏，根本没法用,0,1,0,0,0,0,0,0,0,1,0,0,0,0,0,0,0
951,为什么有的主题要钱,1,0,0,0,0,0,0,0,0,0,0,0,0,0,0,0,0
952,我也不知道我的上一条评论能不能过！但是这是事实！,0,0,0,0,0,0,0,0,0,0,0,0,0,0,0,0,1
953,不好用，懒死了,0,0,0,0,0,0,0,0,0,0,0,0,0,0,0,0,1
954,更新频繁但没实质， 搞着鸡肋的东西，越发占地方和内存。,0,0,0,0,0,0,0,0,1,0,0,0,0,0,0,1,0
955,烂货一个，越更新越垃圾。果断删除！！,0,0,0,0,0,0,0,0,0,0,0,0,0,0,0,1,0
956,没有5.3.9好，一键清理按键太死板，进入桌面以后分两部分太乱了。立马卸载~~,0,0,0,0,0,0,0,0,0,0,1,0,0,0,0,1,0
957,更新以后运行不了，一直卡,0,0,0,1,0,0,0,0,0,0,0,0,0,0,0,1,0
958,更新后不好用,0,0,0,0,0,0,0,0,0,0,0,0,0,0,0,1,0
959,越改越差，,0,0,0,0,0,0,0,0,0,0,0,0,0,0,0,1,0
960,尼玛，更新之后我之前买的主题都没有了,0,1,0,0,0,0,0,0,0,0,0,0,0,0,0,1,0
961,新版不好用，没有上个版本好用，后悔升级。,0,0,0,0,0,0,0,0,0,0,0,0,0,0,0,1,0
962,不如上个版本   好后悔  不该升级的,0,0,0,0,0,0,0,0,0,0,0,0,0,0,0,1,0
963,没有上一个好,0,0,0,0,0,0,0,0,0,0,0,0,0,0,0,1,0
964,垃圾，不如不升级了，怎么还原啊啊啊啊,0,0,0,0,0,0,0,0,0,0,0,0,0,0,0,1,0
965,我的文档不能隐藏，而且加锁加密的文件居然能显示，，不能在桌面增加快捷键“进入抽屉”图标，，，下次不改正，果断卸载，，这次更新好失望,0,1,0,0,0,1,0,0,0,0,0,0,0,0,0,1,0
966,使用后，总体还行，就是很占内存，运行一两个手机软件就会短暂的迟钝和黑屏，其他都好,0,0,0,0,0,0,0,0,1,1,0,0,0,0,0,0,0
967,比以前用起来卡，太卡了,0,0,0,0,0,0,0,0,0,1,0,0,0,0,0,0,0
968,不要别的，光要主题，装的太多，太乱，,0,0,0,0,0,0,0,0,0,0,0,0,0,0,0,0,1
969,我感觉旧版的很好，很简洁，新版的菜单上加了几个字看着不好了还是以前的没有字算是应用图标的好，,0,0,0,0,0,0,0,0,0,0,1,0,0,0,0,1,0
970,虽然一直很支持360，但这次很卡，果断还原旧版,0,0,0,0,0,0,0,0,0,1,0,0,0,0,0,1,0
971,新版不好，用了两年了，真有点舍不得删，但新版弄得越来越繁琐，真心不如不用桌面了！比我初始桌面还复杂，有没有老版的桌面啊，想下回老版的。,0,0,0,0,0,0,0,0,0,0,1,0,0,0,0,1,0
972,新版太烂了,0,0,0,0,0,0,0,0,0,0,0,0,0,0,0,1,0
973,更新后，好垃圾，想卸载了,0,0,0,0,0,0,0,0,0,0,0,0,0,0,0,1,0
974,卡，果断还原,0,0,0,0,0,0,0,0,0,1,0,0,0,0,0,1,0
975,这个版本的时间能不能不透明？我擦,0,0,0,0,0,1,0,0,0,0,0,0,0,0,0,1,0
976,搞什么嘛 更新后找设置 找了半天，，不看评论还不知道呢 也许是我太笨了吧,0,0,0,0,0,0,0,0,0,0,0,0,0,0,0,1,0
977,明星壁纸太少，好看的都要钱,1,0,0,0,0,0,0,0,0,0,0,0,0,0,1,0,0
978,每隔一个版本就很卡！奇怪的规律一直在等着下次更新啊，这个版本好卡啊,0,0,0,0,0,0,0,0,0,1,0,0,0,0,0,1,0
979,下了360桌面，发现了天气有时有点卡，有时死机，让我失望了，希望改一改吧！,0,0,0,1,0,0,0,0,0,1,0,0,0,0,0,0,0
980,程序自动归类功能呢？？？现在连手动归类都不行了,0,0,0,0,0,1,0,0,0,0,0,0,0,0,0,0,0
981,好吧，不得不说这东西差到无力吐槽了，一下载手机就直接崩溃了……,0,0,0,1,0,0,0,0,0,0,0,0,0,0,0,0,0
982,太卡了,0,0,0,0,0,0,0,0,0,1,0,0,0,0,0,0,0
983,更新后，不能隐藏桌面通知栏了！,0,0,0,0,0,1,0,0,0,0,0,0,0,0,0,1,0
984,好垃圾，不好用，别下,0,0,0,0,0,0,0,0,0,0,0,0,0,0,0,0,1
985,一个主题还得要钱买,1,0,0,0,0,0,0,0,0,0,0,0,0,0,0,0,0
986,垃圾中的战斗机,0,0,0,0,0,0,0,0,0,0,0,0,0,0,0,0,1
987,绑定不了，一下就退出来了,0,1,0,1,0,0,0,0,0,0,0,0,0,0,0,0,0
988,老是更新。有时更新还是没有什么新功能。,0,0,0,0,0,0,0,0,0,0,0,0,0,0,0,1,0
989,怎样弄第三张图片的那个爱心啊?,0,0,0,0,0,0,0,0,0,0,0,0,0,0,0,0,1
990,没有以前的好，动态不能用，显示成功了，可是还是没有。,0,1,0,0,0,0,0,0,0,0,0,0,0,0,0,1,0
991,升级完为什么不能设置动态壁纸了！设置的时候提示设置成功 回到桌面后发现没有显示！！望能改进些  其他都还好,0,1,0,0,0,0,0,0,0,0,0,0,0,0,0,1,0
992,我操    你敢不敢不要钱   要是不要钱    会有多少人说你好,1,0,0,0,0,0,0,0,0,0,0,0,0,0,0,0,0
993,还可以   要钱的是主题   你可以放照片做壁纸啊,0,0,0,0,0,0,0,0,0,0,0,0,0,0,0,0,1
994,。。。天哪，老是要下載這個下載那個太煩了，而且主題真的不好看咯,0,0,0,0,0,0,0,0,0,0,0,0,0,0,0,0,1
995,漂亮的还得付钱,1,0,0,0,0,0,0,0,0,0,0,0,0,0,0,0,0
996,他妈开死了！！！！！！！！,0,0,0,0,0,0,0,0,0,0,0,0,0,0,0,0,1
997,本来觉得很好，可以好看的全是收费。收费你就标清楚啊，体验个毛，弄得浪费流量浪费感情浪费时间。,1,0,0,0,0,0,0,0,0,0,0,0,0,0,0,0,0
998,还要钱，不好！,1,0,0,0,0,0,0,0,0,0,0,0,0,0,0,0,0
999,主题怎么换不了啊,0,1,0,0,0,0,0,0,0,0,0,0,0,0,0,0,0
1000,又更新？？？！！,0,0,0,0,0,0,0,0,0,0,0,0,0,0,0,1,0
1001,更新太勤了吧，有简单的吗？功能太多了,0,0,0,0,0,0,0,0,0,0,0,0,0,0,0,1,0
1002,下过的壁纸无法删除，而且速度有点慢，手机会无故多了许多照片。,0,0,0,0,0,1,0,0,0,1,0,0,0,0,0,0,0
1003,超级卡。。。,0,0,0,0,0,0,0,0,0,1,0,0,0,0,0,0,0
1004,原版本才不卡啊因为我一直支持360给个中评（原版本是5.3.3的）,0,0,0,0,0,0,0,0,0,0,0,0,0,0,0,1,0
1005,更新后好卡 还说什么节约内存 忽悠人呢啊,0,0,0,0,0,0,0,0,0,1,0,0,0,0,0,1,0
1006,功能挺多，但很耗内存，推荐尖端桌面，速度快，功能够用,0,0,0,0,0,0,0,0,1,0,0,0,0,0,0,0,0
1007,真恨今天手贱点了更新！要是有个平台提供app旧版本恢复，必火！,0,0,0,0,0,0,0,0,0,0,0,0,0,0,0,1,0
1008,哎 要收钱了 没有新主题 就没意思了,1,0,0,0,0,0,0,0,0,0,0,0,0,0,0,0,0
1009,为什么用360桌面就显示不了卫士的加速球了。而且为什么那么多插件。求解。,0,1,0,0,1,0,0,0,0,0,0,0,0,0,0,0,0
1010,我操,0,0,0,0,0,0,0,0,0,0,0,0,0,0,0,0,1
1011,中间变的很难看，而且就是难看的一b,0,0,0,0,0,0,0,0,0,0,1,0,0,0,0,0,0
1012,功能还凑合，就是样子太丑了,0,0,0,0,0,0,0,0,0,0,1,0,0,0,0,0,0
1013,表示完美卡死,0,0,0,0,0,0,0,0,0,1,0,0,0,0,0,0,0
1014,尼玛，360你伤不起,0,0,0,0,0,0,0,0,0,0,0,0,0,0,0,0,1
1015,丑，卡,0,0,0,0,0,0,0,0,0,1,1,0,0,0,0,0,0
1016,新版的时钟天气难看死了,0,0,0,0,0,0,0,0,0,0,1,0,0,0,0,1,0
1017,为毛我下载的字体总是在开机重启之后恢复默认的了，太坏人心情了(>_<),0,1,0,0,0,0,0,0,0,0,0,0,0,0,0,0,0
1018,垃圾，下主题还要钱,1,0,0,0,0,0,0,0,0,0,0,0,0,0,0,0,0
1019,可以设置屏幕滚动吗？,0,0,0,0,0,1,0,0,0,0,0,0,0,0,0,0,0
1020,要有点心怎么流畅就好了，那我就下你了，可是卡没办法我只能下点心了！,0,0,0,0,0,0,0,0,0,1,0,0,0,0,0,0,0
1021,好看的主题少得可怜。,0,0,0,0,0,0,0,0,0,0,0,0,0,0,1,0,0
1022,垃圾,0,0,0,0,0,0,0,0,0,0,0,0,0,0,0,0,1
1023,....0..0.,0,0,0,0,0,0,0,0,0,0,0,0,0,0,0,0,1
1024,就是有点卡,0,0,0,0,0,0,0,0,0,1,0,0,0,0,0,0,0
1025,真的，一星都不想给。。什么破东西啊又丑又烂，我去。。。,0,0,0,0,0,0,0,0,0,0,1,0,0,0,0,0,0
1026,很漂亮，功能多，可是太占内存太费电,0,0,0,0,0,0,0,0,1,0,0,0,0,0,0,0,0
1027,表示很占系统内存！！！,0,0,0,0,0,0,0,0,1,0,0,0,0,0,0,0,0
1028,下个主题还要钱,1,0,0,0,0,0,0,0,0,0,0,0,0,0,0,0,0
1029,卡-_-||,0,0,0,0,0,0,0,0,0,1,0,0,0,0,0,0,0
1030,大多要钱的。,1,0,0,0,0,0,0,0,0,0,0,0,0,0,0,0,0
1031,有大问题，机器成砖了，遇到过好多台因为安装了360桌面而变成砖的手机，无法启动，卡在界面上,0,0,0,1,0,0,0,0,0,0,0,0,0,0,0,0,0
1032,时钟。小天气 经常好好的就消失了。。,0,1,0,0,0,0,0,0,0,0,0,0,0,0,0,0,0
1033,还行,0,0,0,0,0,0,0,0,0,0,0,0,0,0,0,0,1
1034,g17 用过一段时间，不明原因死机，并无法开机。不敢用了。对了，我的是美国货，难道被和谐了？,0,0,1,1,0,0,0,0,0,0,0,0,0,0,0,0,0
1035,缩略图一直刷不出来~~~公司还是10M电信光纤，360你赶紧更新吧,0,0,0,0,0,0,1,0,0,0,0,0,0,0,0,0,0
1036,个人比较喜欢安卓桌面,0,0,0,0,0,0,0,0,0,0,0,0,0,0,0,0,1
1037,太占内存了，其他的都还好，希望能做的下一点，我这游戏一返回就卡到桌面了！,0,0,0,0,0,0,0,0,1,0,0,0,0,0,0,0,0
1038,，！⊙▽⊙,0,0,0,0,0,0,0,0,0,0,0,0,0,0,0,0,1
1039,主题不是很好看，好看的要钱,1,0,0,0,0,0,0,0,0,0,0,0,0,0,0,0,1
1040,以前很好，新版本一天无反应三、四次，郁闷！,0,0,0,1,0,0,0,0,0,0,0,0,0,0,0,1,0
1041,想换主题换不了以后，打算卸载重下过，没想到手机就死机了，一直重复开机关机。只能是刷机，弄到麻烦死了。,0,1,0,0,0,0,0,0,0,0,0,0,0,0,0,0,0
1042,一打开全是捆绑软件 还不能卸载。只能说我不喜欢,0,0,0,0,1,0,0,0,0,0,0,0,0,0,0,0,0
1043,窗口小部件不能用！！！,0,0,0,0,0,1,0,0,0,0,0,0,0,0,0,0,0
1044,吖的真烦人！360咋就这么喜欢摆架子呢！心想安装个天气插件！妹的居然提示必须先下载尼玛的桌面！老子不要了！果断卸载！,0,0,0,0,0,0,0,0,0,0,0,0,0,0,0,0,1
1045,怎么进 win8？  求解,0,0,0,0,0,0,0,0,0,0,0,0,0,0,0,0,1
1046,尼玛更新后开不起了！,0,0,0,1,0,0,0,0,0,0,0,0,0,0,0,1,0
1047,不可以使用小窗口部件！希望能改进！,0,0,0,0,0,1,0,0,0,0,0,0,0,0,0,0,0
1048,我怎么觉得不好用啊，主要是下载后的主题，只能当天用，第二天开机后全不能用了，怎么回事啊？？？,0,1,0,0,0,0,0,0,0,0,0,0,0,0,0,0,0
1049,用时间长会卡死，我同学用的卡的联菜单都进不去，她有没开USB调试，让修不能修，只能反厂了,0,0,0,0,0,0,0,0,0,1,0,0,0,0,0,0,0
1050,重新更新以后主题都要登录，居然还登录不了，不知道该怎么弄了,0,1,0,0,0,0,0,0,0,0,0,0,0,0,0,1,0
1051,靠了  一更新把轮换壁纸给去了   更新毛啊,0,0,0,0,0,1,0,0,0,0,0,0,0,0,0,1,0
1052,设置默认桌面怎么设置不了了，郁闷，每次还要自己动手，郁闷！,0,1,0,0,0,0,0,0,0,0,0,0,0,0,0,0,0
1053,试了一次桌面不错不过不能设置窗口小部件，，，我用天天动听安卓系统放一个桌面用习惯了这个用感觉不舒服,0,0,0,0,0,1,0,0,0,0,0,0,0,0,0,0,0
1054,不管是动网还是wifi网都无法连接网络,0,0,0,0,0,0,1,0,0,0,0,0,0,0,0,0,0
1055,脱一下桌面就闪一下。,0,1,0,0,0,0,0,0,0,0,0,0,0,0,0,0,0
1056,有点卡，狂点程序都进不去，忘改善,0,0,0,0,0,0,0,0,0,1,0,0,0,0,0,0,0
1057,图标太难看了,0,0,0,0,0,0,0,0,0,0,1,0,0,0,0,0,0
1058,为什么我的安全桌面设置不了！求大神赐教,0,1,0,0,0,0,0,0,0,0,0,0,0,0,0,0,0
1059,更新后以前的主题全都用不了了,0,1,0,0,0,0,0,0,0,0,0,0,0,0,0,1,0
1060,越变越难看,0,0,0,0,0,0,0,0,0,0,1,0,0,0,0,1,0
1061,换了之后无缘无故把我的壁纸换成新春版的，之前的版本都不会,0,0,0,0,0,0,0,0,0,0,0,0,0,0,0,1,0
1062,左上方一直有带问号的机器人真烦人,0,0,0,0,1,0,0,0,0,0,0,0,0,0,0,0,0
1063,"真后悔更新了,每次重启设置都会恢复默认，怎么设置都不行,烦死了.就算只用360的默认桌面也还是每次都问,有没有办法弄掉啊. 能不能卸载了在安装原来版本的啊? 以后再也不更新了.还说专业。",0,1,0,0,0,0,0,0,0,0,0,0,0,0,0,1,0
1064,这个桌面一开机就安装 以前下载的两个主题突然用不了。改的什么狗屁东西。果断用回GO桌面,0,1,0,0,0,0,0,0,0,0,0,0,0,0,0,0,0
1065,更新后问题多多，重开机需要重新安装，重新设置等,0,1,0,0,0,0,0,0,0,0,0,0,0,0,0,1,0
1066,强烈建议优化通知栏,0,0,0,0,0,0,0,0,0,0,0,0,0,0,0,0,1
1067,铃声设置太那个拉,0,0,0,0,0,0,0,0,0,0,0,0,0,0,0,0,1
1068,靠，没有了新闻。语音神马的不需要啊，我要新闻,0,0,0,0,0,1,0,0,0,0,0,0,0,0,0,0,0
1069,为什么一直初始化？,0,0,0,0,0,0,0,0,0,0,0,0,0,0,0,0,1
1070,为什么更新之后需要每次重新设置拨打电话的软件？,0,1,0,0,0,0,0,0,0,0,0,0,0,0,0,0,0
1071,慢。。。而且好丑。跟go索赔那个却完全不能比、,0,0,0,0,0,0,0,0,0,1,1,0,0,0,0,0,0
1072,太占用内存了,0,0,0,0,0,0,0,0,1,0,0,0,0,0,0,0,0
1073,好看是好看，可是要流量的。。哎。。╮(╯▽╰)╭,0,0,0,0,0,0,0,0,0,0,0,0,0,0,0,0,1
1074,为什么我用几次后我的桌面的时间和天气就自动没有了呢这是怎么一回事儿？？,0,1,0,0,0,0,0,0,0,0,0,0,0,0,0,0,0
1075,整合了一堆360的东西。,0,0,0,0,0,0,0,0,0,0,0,0,0,0,0,0,1
1076,laji表删除,0,0,0,0,0,0,0,0,0,0,0,0,0,0,0,0,1
1077,安卓4.1不能使用,0,0,1,1,0,0,0,0,0,0,0,0,0,0,0,0,0
1078,设置软件头像自定义图片会强退 求解决,0,1,0,1,0,0,0,0,0,0,0,0,0,0,0,0,0
1079,我安装以后，每次打电话按拨号键的时候，都要过个四五秒才出现拨号键，卡~~~~~~~~~~,0,0,0,0,0,0,0,0,0,1,0,0,0,0,0,0,0
1080,虽然暂时卸载了，还是挺喜欢这款软件的，功能很好。上上次更新之前一直都很好，但是之后就越来越卡了，占用内存太大，经常接近90%，把整个手机都弄得很慢。卸载之后维持在40%左右。期待改进。。。,0,0,0,0,0,0,0,0,1,1,0,0,0,0,0,1,0
1081,太占运行内存,0,0,0,0,0,0,0,0,1,0,0,0,0,0,0,0,0
1082,旧版的比较好用哦 没有新版的那么卡,0,0,0,0,0,0,0,0,0,1,0,0,0,0,0,1,0
1083,"装了，又卸载了。
因为装在TF卡中的图标不能正常显示。",0,1,0,0,0,0,0,0,0,0,0,0,0,0,0,0,0
1084,还是火腿肠的桌面好,0,0,0,0,0,0,0,0,0,0,0,0,0,0,0,0,1
1085,是的，太费电,0,0,0,0,0,0,0,0,1,0,0,0,0,0,0,0,0
1086,中间的菜单键  希望下个版本可以挪动到旁边,0,0,0,0,0,0,0,0,0,0,1,0,0,0,0,0,0
1087,与其说用360桌面流畅，还不如说用原厂的更流畅。。。,0,0,0,0,0,0,0,0,0,0,0,0,0,0,0,0,1
1088,卸了GO  安装这个以后很喜欢 可是功能表的竖向排列界面太丑了  就是这个原因 我不得不卸载   改进吧  我一定会用的,0,0,0,0,0,0,0,0,0,0,1,0,0,0,0,0,0
1089,"是不是有广告啊,在通知栏里面总是出现一些让我下载的东西, 关键是还删不了,总是在那里。",0,0,0,0,1,0,0,0,0,0,0,0,0,0,0,0,0
1090,等到这个软件的功能超过go桌面的功能的时候再下···,0,0,0,0,0,0,0,0,0,0,0,0,0,0,0,0,1
1091,一根新就出现问题 屏幕开始模糊然后自己重启 重启好了后不管打开什么软件 又自动重启,0,0,0,1,0,0,0,0,0,0,0,0,0,0,0,1,0
1092,安装后重启：系统进入不去了。我的是昂达VI30豪华版V4,0,0,1,1,0,0,0,0,0,0,0,0,0,0,0,0,0
1093,前面几版到还不错，升级后长期占用CPU80%以上，卡死，发热,0,0,0,0,0,0,0,0,1,1,0,0,0,0,0,1,0
1094,是不是和4.0不兼容啊？刷了4.0后，卡到想死，玩游戏也卡！烦死了！,0,0,1,0,0,0,0,0,0,1,0,0,0,0,0,0,0
1095,锁定壁纸怎么换,0,0,0,0,0,0,0,0,0,0,0,0,0,0,0,0,1
1096,与多景桌面冲突,0,0,0,0,0,0,0,0,0,0,0,0,0,0,0,0,1
1097,到底行不行啊。,0,0,0,0,0,0,0,0,0,0,0,0,0,0,0,0,1
1098,安装的4.1的版本，好多功能都被360桌面屏蔽了，还是有缺陷,0,0,0,0,0,0,0,0,0,0,0,0,0,0,0,0,1
1099,为啥更新之后卡了，关机又开机就自动锁屏，并且还进不了？,0,1,0,1,0,0,0,0,0,1,0,0,0,0,0,1,0
1100,不错！UI很好，但锁屏小工具要自己下载。,0,0,0,0,0,0,0,0,0,0,0,0,0,0,0,0,1
1101,挺好，挺流畅，简单~~学起  TX  模仿来了，模仿GO桌面。稍稍不必GO卡而已,0,0,0,0,0,0,0,0,0,0,0,0,0,0,0,0,1
1102,有点模仿go桌面吧？,0,0,0,0,0,0,0,0,0,0,0,0,0,0,0,0,1
1103,难道360准备只走高端机路线了吗，不给小内存手机活路？？该放弃了,0,0,0,0,0,0,0,0,1,0,0,0,0,0,0,0,0
1104,没办法去托板 背板 越改越垃圾,0,0,0,0,0,1,0,0,0,0,0,0,0,0,0,1,0
1105,比起上个版本  丑的个渣,0,0,0,0,0,0,0,0,0,0,1,0,0,0,0,1,0
1106,"强烈要求恢复背板功能,",0,0,0,0,0,1,0,0,0,0,0,0,0,0,0,0,0
1107,插件太多，而且又要另外下载,0,0,0,0,1,0,0,0,0,0,0,0,0,0,0,0,0
1108,三星i9100表示不是很满意。 开机桌面程序启动错误，需重新启动（每次开机都是）。还有就是原来支持非360桌面壁纸锁屏，现在不支持。望改进。,0,0,1,1,0,1,0,0,0,0,0,0,0,0,0,1,0
1109,千万别升级2.2.1啊  超卡的,0,0,0,0,0,0,0,0,0,1,0,0,0,0,0,1,0
1110,用六个字可以精确的形容：越升级，越垃圾,0,0,0,0,0,0,0,0,0,0,0,0,0,0,0,1,0
1111,谁有以前的版本。强烈要求改回去。下了桌面，又下天气工具。不知道怎么的，桌面上不显示天气了。刷新天气又说无法刷新。原本的按主页面却回到手机自带的桌面去。然后重新调回到360的桌面。来回几次，弄的不敢按主页面键。真闹心,0,1,0,0,0,0,0,0,0,0,0,0,0,0,0,1,0
1112,鄙视360！！！！！太黑了，竟然加个不让删除的，我要卸载了它,0,0,0,0,0,0,0,0,0,0,0,0,0,0,0,0,1
1113,先是一键锁屏不管用 后面就是有问题强行关闭 什么玩意,0,1,0,1,0,0,0,0,0,0,0,0,0,0,0,0,0
1114,我从2.0升级到2.1，原本自带的时钟天气没了还有我下的时钟天气的皮肤也不见了...我的流量啊,0,0,0,0,0,1,0,0,0,0,0,0,0,0,0,1,0
1115,为什么更新之后需要单独下载天气小工具，桌面占内存，时钟天气又要占内存，有点退步了！,0,0,0,0,0,0,0,0,1,0,0,0,0,0,0,1,0
1116,个人觉得还是1.6比较好 不建议更新,0,0,0,0,0,0,0,0,0,0,0,0,0,0,0,1,0
1117,我的1.6版本在手机上更新不了，手机助手也没显示能升级。2.1的用手机助手下载不了,0,0,0,0,0,0,0,0,0,0,0,0,0,0,0,0,1
1118,好好的天气时钟写了个推荐,0,0,0,0,0,0,0,0,0,0,0,0,0,0,0,0,1
1119,抽屉太丑了 还是1.6bete 版本 4x4的 美观大方 快点开发隐藏状态栏功能啊 ！！！团队 燃烧吧 战斗吧 ,0,0,0,0,0,1,0,0,0,0,1,0,0,0,0,1,0
1120,"怎么下呀？
下了也不知道怎么安装。",0,0,0,0,0,0,0,0,0,0,0,0,0,0,0,0,1
1121,看片加我,0,0,0,0,0,0,0,0,0,0,0,0,0,0,0,0,1
1122,登录都登不了，破软件,0,1,0,0,0,0,0,0,0,0,0,0,0,0,0,0,0
1123,为啥视频打开加载的很慢，播放也超卡的,0,0,0,0,0,0,1,0,0,0,0,0,0,0,0,0,0
1124,为什么在线看不了视频一点播放就视频配置加载失败,0,1,0,0,0,0,0,0,0,0,0,0,0,0,0,0,0
1125,我觉得一切都OK，就是上传速度与下载速度太慢，太慢，太慢，重要的事说三遍！,0,0,0,0,0,0,1,0,0,0,0,0,0,0,0,0,0
1126,为什么保存的时候总是保存不上,0,1,0,0,0,0,0,0,0,0,0,0,0,0,0,0,0
1127,不能上传了,0,1,0,0,0,0,0,0,0,0,0,0,0,0,0,0,0
1128,无法登陆！,0,1,0,0,0,0,0,0,0,0,0,0,0,0,0,0,0
1129,啥玩意儿啊！视频都看不了,0,0,0,0,0,0,0,0,0,0,0,0,0,0,0,0,1
1130,备份不了照片,0,0,0,0,0,0,0,0,0,0,0,0,0,0,0,0,1
1131,上传时间一长，网络错误,0,0,0,0,0,0,1,0,0,0,0,0,0,0,0,0,0
1132,如果把手机里的所有文件，音乐等东西上传到360云盘，我再把手机里面的东西删掉，这样的文件还在手机里吗？！？求教,0,0,0,0,0,0,0,0,0,0,0,0,0,0,0,0,1
1133,经常闪退,0,0,0,1,0,0,0,0,0,0,0,0,0,0,0,0,0
1134,这个百度的还要会员才能上传视频无语,1,0,0,0,0,0,0,0,0,0,0,0,0,0,0,0,0
1135,为什么现在上传照片这么慢！,0,0,0,0,0,0,1,0,0,0,0,0,0,0,0,0,0
1136,希望可以把上传速度调快点，十张照片，要十五分钟，可以调成闪传最好了，以前都是闪传的，现在都没有了。,0,0,0,0,0,1,0,0,0,0,0,0,0,0,0,0,0
1137,我也是啊升级了打不开了。卸载后OK了。退出后又这样,0,0,0,0,0,0,0,0,0,0,0,0,0,0,0,1,0
1138,三星S7僵尸一个,0,0,0,0,0,0,0,0,0,0,0,0,0,0,0,0,1
1139,登上去一次，然后关闭，在登陆，就打不开了。太垃圾。,0,1,0,0,0,0,0,0,0,0,0,0,0,0,0,0,0
1140,闪退，以前上传的视频也没有了,0,0,0,1,0,0,0,0,0,0,0,0,0,0,0,0,0
1141,闪退，闪退，闪退，怎么搞的,0,0,0,1,0,0,0,0,0,0,0,0,0,0,0,0,0
1142,一个月一半时间不能用，太垃圾了,0,0,0,0,0,0,0,0,0,0,0,0,0,0,0,0,1
1143,咁好用嘅云盘点解要关闭。总要同老百姓过唔去,0,0,0,0,0,0,0,0,0,0,0,0,0,0,0,0,1
1144,今天一直上不去,0,0,0,0,0,0,0,0,0,0,0,0,0,0,0,0,1
1145,为啥不再更新了，360云盘是要下架的节奏。,0,0,0,0,0,0,0,0,0,0,0,0,0,0,0,0,1
1146,新版打不开,0,0,0,0,0,0,0,0,0,0,0,0,0,0,0,1,0
1147,对于360的软件我一向是挺喜欢，可是云盘真的是.......WiFi环境下也打不开图片啊,0,1,0,0,0,0,0,0,0,0,0,0,0,0,0,0,0
